d	a	t	e	,	t	i	t	l	e	,	h	o	s	t	n	a	m	e	,	c	a	t	e	g	o	r	y
2014-03-10	fed official says weak data caused by weather, should not slow taper	www.latimes.com	b
2014-03-10	fed's charles plosser sees high bar for change in pace of tapering	www.livemint.com	b
2014-03-10	us open: stocks fall after fed official hints at accelerated tapering	www.ifamagazine.com	b
2014-03-10	fed risks falling 'behind the curve', charles plosser says	www.ifamagazine.com	b
2014-03-10	fed's plosser: nasty weather has curbed job growth	www.moneynews.com	b
2014-03-10	plosser: fed may have to accelerate tapering pace	www.nasdaq.com	b
2014-03-10	fed's plosser: taper pace may be too slow	www.marketwatch.com	b
2014-03-10	fed's plosser expects us unemployment to fall to 6.2 by the end of 2014	www.fxstreet.com	b
2014-03-10	us jobs growth last month hit by weather:fed president charles plosser	economictimes.indiatimes.com	b
2014-03-10	ecb unlikely to end sterilisation of smp purchases - traders	www.iii.co.uk	b
2014-03-10	ecb unlikely to end sterilization of smp purchases: traders	in.reuters.com	b
2014-03-10	eu's half-baked bank union could work	blogs.reuters.com	b
2014-03-10	europe reaches crunch point on banking union	in.reuters.com	b
2014-03-10	ecb focus-stronger euro drowns out ecb's message to keep rates low for  	in.reuters.com	b
2014-03-10	eu aims for deal on tackling failing banks	main.omanobserver.om	b
2014-03-10	forex - pound drops to one-month lows against euro	www.nasdaq.com	b
2014-03-10	noyer says strong euro creates unwarranted economic pressure	www.sfgate.com	b
2014-03-10	eu week ahead march 10-14: bank resolution, transparency, ukraine	blogs.wsj.com	b
2014-03-10	ecb member noyer is 'very open to all kinds of tools'	www.ifamagazine.com	b
2014-03-10	euro anxieties wane as bunds top treasuries, spain debt rallies	www.businessweek.com	b
2014-03-10	noyer says strong euro creates unwarranted economic pressure 1	www.businessweek.com	b
2014-03-10	noyer says stronger euro creates unwarranted pressure on economy	www.sfgate.com	b
2014-03-10	bad loan triggers key feature in ecb bank test announcement: sources	www.globalpost.com	b
2014-03-10	china's trade deficit and structural worries in europe, among the main issues	www.fxstreet.com	b
2014-03-10	10 things you need to know this morning	www.businessinsider.com	b
2014-03-10	ecb's noyer not happy with euro strength -- update	online.wsj.com	b
2014-03-10	eurozone banks' sovereign exposure hits new high	www.ekathimerini.com	b
2014-03-10	ecb to reveal bad loan hurdles for euro zone bank test	www.irishtimes.com	b
2014-03-10	forex market: eurusd retreats from 2-12-year highs as stronger euro seen  	www.binarytribune.com	b
2014-03-10	refile-bad loan triggers key feature in ecb bank test announcement- sources	in.reuters.com	b
2014-03-10	update 1-ecb to reveal bad loan hurdles for euro zone bank test -sources	in.reuters.com	b
2014-03-10	ecb to reveal bad loan hurdles for euro zone bank test - sources	www.euronews.com	b
2014-03-10	ecb requires tougher call on bad loan definition	www.ifamagazine.com	b
2014-03-10	ecb to reveal bad loan hurdles for bank tests?	www.rte.ie	b
2014-03-10	10 things you need to know before the opening bell	www.businessinsider.in	b
2014-03-10	central banks must contain threats from low prices: ecb's noyer	www.reuters.com	b
2014-03-10	update 1-central banks must contain threat from low prices -noyer	in.reuters.com	b
2014-03-10	ecb's noyer says 'not happy' with euro's rise	in.reuters.com	b
2014-03-10	ecb's noyer: low inflation may hamper adjustment	www.marketwatch.com	b
2014-03-10	ecb's christian noyer says 'not happy' with euro's rise	economictimes.indiatimes.com	b
2014-03-10	sterling at one-month low as ecb policy stance lifts euro	economictimes.indiatimes.com	b
2014-03-10	eu aims for deal on tackling failing banks next week	money.msn.com	b
2014-03-10	failing banks focus of eu talks	www.irishexaminer.com	b
2014-03-10	business growth in euro zone rises to 32-month high	main.omanobserver.om	b
2014-03-10	poking the eurozone bear	www.europeanvoice.com	b
2014-03-10	ecb unlocks door for further euro strength - will data allow?	www.dailyfx.com	b
2014-03-10	omega's cooperman says ebay should spin off portion of paypal: cnbc	www.chicagotribune.com	b
2014-03-10	ebay, icahn talk smack	blog.seattlepi.com	b
2014-03-10	both ways	www.business-standard.com	b
2014-03-10	why ebay spinning off paypal makes sense	www.dailyfinance.com	b
2014-03-10	carl icahn rift hurts ebay ebay	www.thestreet.com	b
2014-03-10	ebay rejects icahn slate of directors	www.news-sentinel.com	b
2014-03-10	carl icahn: ebay shareholders lost 4 billion because of the ceo's  	www.businessinsider.in	b
2014-03-10	ebay to shareholders: vote against icahn nominees	www.foxbusiness.com	b
2014-03-10	ebay rejects icahn board nominees, asks investors to do same	www.reuters.com	b
2014-03-10	icahn targets ebay chief donahoe after company rejects board slate	www.forbes.com	b
2014-03-10	tech stocks: ebay and icahn keep trading punches	english.capital.gr	b
2014-03-10	ebay asks shareholders to vote against carl icahn board nominees	economictimes.indiatimes.com	b
2014-03-10	ebay asks shareholders to vote against icahn board nominees	www.bnn.ca	b
2014-03-10	ebay and icahn keep trading punches	www.marketwatch.com	b
2014-03-10	ebay rejects icahn board picks as activist strikes again	www.law360.com	b
2014-03-10	ebay asks shareholders to vote against paypal split while icahn claims ceo  	techcrunch.com	b
2014-03-10	ebay rejects carl icahn's director nominees, urges reelection of its 4 directors	www.globalpost.com	b
2014-03-10	ebay ceo donahoe's pay drops by 53 to 13.8 million for 2013	www.businessweek.com	b
2014-03-10	ebay rejects carl icahn's board nominees and says his attacks are 'false and  	www.businessinsider.in	b
2014-03-10	ebay rejects carl icahn board nominees, asks investors to do same	www.livemint.com	b
2014-03-10	ebay's john donahoe talks icahn, conflicts, and 100 stock price someday	tech.fortune.cnn.com	b
2014-03-10	ebay urgest shareholders to reject icahn's board nominees	www.cnbc.com	b
2014-03-10	carl icahn slams ebay ceo	www.cityam.com	b
2014-03-10	icahn claims inexcusable incompetence of ebay ceo cost stockholders 4 billion	wallstreetpit.com	b
2014-03-10	ebay rejects carl icahn's director nominees, urges reelection of its 4 directors  	www.tribtown.com	b
2014-03-10	update 1-ebay rejects icahn board nominees, asks investors to do same	in.reuters.com	b
2014-03-10	ebay rejects icahn board nominees, urges investors to do same	www.theglobeandmail.com	b
2014-03-10	carl icahn: donahoe cost ebay investors more than 4b	www.valuewalk.com	b
2014-03-10	ebay urges shareholders to vote against icahn board nominees	www.theglobeandmail.com	b
2014-03-10	ebay asks stockholders to oppose icahn nominees	news.muckety.com	b
2014-03-10	ebay says carl icahn's board picks 'not qualified'	www.marketwatch.com	b
2014-03-10	mcdonald's struggles worsened by snow	www.bradenton.com	b
2014-03-10	food: mcdonald's game plan to win back customers	www.newsherald.com	b
2014-03-10	mcdonald's reports drop in february global sales	www.kpinsider.com	b
2014-03-10	mcdonald's game plan to win back customers	www.stamfordadvocate.com	b
2014-03-10	mcdonald's sales decline as chain looks to adapt to changing tastes	www.newser.com	b
2014-03-10	3 things to watch for as mcdonald's fights to boost us sales	www.globalpost.com	b
2014-03-10	mcdonald's sales dip amid shifting eating habits	www.ocala.com	b
2014-03-10	mcdonald's sales dip amid shifting eating habits, worsened by snow	www.deseretnews.com	b
2014-03-10	mcdonald's february us sales chilled by weather	www.tuscaloosanews.com	b
2014-03-10	mcdonald's us sales fall 1.4 per cent in february as chain looks to adapt to  	www.globalpost.com	b
2014-03-10	mcdonald's corporation mcd february sales results decline	www.valuewalk.com	b
2014-03-10	mcdonald's sales decline as chain looks to adapt to changing tastes  the  	www.tribtown.com	b
2014-03-10	mcdonald's to try build-your-own-burger menu	www.theindychannel.com	b
2014-03-10	mcdonald's us sales continue to struggle in february	www.gmanetwork.com	b
2014-03-10	5 20-piece chicken nuggets didn't help mcdonald's reverse us sales decline	blogs.marketwatch.com	b
2014-03-10	burn: mcdonald's business did not heat up in february	wallstcheatsheet.com	b
2014-03-10	mcdonald's february same-restaurant sales fall 0.3	www.bnn.ca	b
2014-03-10	mcdonald's posts weak february sales results	www.proactiveinvestors.com	b
2014-03-10	update 2-mcdonald's us sales continue to struggle in february	www.reuters.com	b
2014-03-10	mcdonald's sales slip as americans' eating habits shift	www.dailyfinance.com	b
2014-03-10	five guys, chipotle continue to take bites out of mcdonald's sales	www.courierpress.com	b
2014-03-10	mcdonald's reports lower us sales amid bitter cold winter	www.nj.com	b
2014-03-10	mcdonald's not lovin' us sales	www.newsledge.com	b
